Unnamed: 0,address,target_building_id,target_address
12308,"192286, Санкт-Петербург г, Бухарестская ул, д.67, Строение 2",13329,"г.Санкт-Петербург, Бухарестская улица, дом 67, корпус 1"
12449,"192286, Санкт-Петербург г, Димитрова ул, д.18, Строение 4",129542,"г.Санкт-Петербург, проспект Крузенштерна, дом 18, строение 4"
2830,"195271, Санкт-Петербург (г.), Кондратьевский (пр-кт.), д.64, Строение 5",215902,"г.Санкт-Петербург, Комендантский проспект, дом 64, корпус 5, строение 1"
6357,"198332, Санкт-Петербург г, Маршала Жукова пр-кт, д.37, Строение 4",215256,"г.Санкт-Петербург, Железноводская улица, дом 3а, строение 4"
1138,"194223, Санкт-Петербург (г.), Санкт-Петербург г, Тореза пр-кт, д.39-4 А",136976,"г.Санкт-Петербург, Старо-Паново, Набережная улица, дом 39, литера Г2"
10618,"197373, Санкт-Петербург (г.), Санкт-Петербург г, Планерная, д.69, 3, А",4086,"г.Санкт-Петербург, Планерная улица, дом 73, корпус 4, литера Б"
5531,"198205, Санкт-Петербург г, Народного Ополчения пр-кт, д.209, Строение 3",96411,"г.Санкт-Петербург, проспект Народного Ополчения, дом 209, корпус 3, литера А"
7585,"Санкт-Петербург (г.), Октябрьская (наб.), д.34 3, 1",219323,"г.Санкт-Петербург, Октябрьская набережная, дом 34, корпус 3, строение 1"
1427,"194354, Санкт-Петербург (г.), Санкт-Петербург г, Луначарского пр-кт, д.56-2 А",54311,"г.Санкт-Петербург, проспект Большевиков, дом 56, корпус 4, литера Ж"
12616,"191144, Санкт-Петербург г, Дегтярная ул, д.32-36",109001,"г.Санкт-Петербург, Дегтярная улица, дом 32-36, литера А"
9055,"197110, Санкт-Петербург (г.), Петровский (пр-кт.), д.22, Строение М",15552,"г.Санкт-Петербург, Московский проспект, дом 71"
4063,"196655, Санкт-Петербург г, Колпино г, Октябрьская ул, д.35",131844,"г.Санкт-Петербург, Горелово, Береговая улица, дом 35, литера Г5"
10303,"197373, Санкт-Петербург г, Долгоозерная ул, д.4, Строение 3",117365,"г.Санкт-Петербург, Корабельная улица, дом 4, строение 3"
6922,"196191, Санкт-Петербург (г.), Санкт-Петербург г, Ленинский пр-кт, д.168 к3 лА",16983,"г.Санкт-Петербург, Ленинский проспект, дом 61, литера А"
1365,"194291, Санкт-Петербург (г.), Руднева (ул.), д.13, Строение 2",55572,"г.Санкт-Петербург, улица Лётчика Пилютова, дом 13, корпус 2, строение 1"
9817,"197183, Санкт-Петербург г, Школьная ул, д.12",66982,"г.Санкт-Петербург, Школьная улица, дом 12, литера Б"
8083,"192174, Санкт-Петербург г, Красных Зорь б-р, д.22",94333,"г.Санкт-Петербург, Братская улица, дом 22"
8437,"192012, Санкт-Петербург г, Бабушкина ул, д.84",215150,"г.Санкт-Петербург, улица Бабушкина, дом 84, корпус 1, строение 1"
7812,"193318, Санкт-Петербург г, Белышева ул, д.8, Строение 2А",223955,"г.Санкт-Петербург, улица Беринга, дом 27, корпус 8, строение 1"
9951,"197349, Санкт-Петербург г, Маршала Новикова ул, д.2, Строение 2",5917,"г.Санкт-Петербург, Новоизмайловский проспект, дом 73, литера А"
3838,"198184, Санкт-Петербург (г.), Санкт-Петербург г, Канонерский остров, д.21",211906,"г.Санкт-Петербург, Канонерский остров, дом 21, строение 1"
12458,"192283, Санкт-Петербург г, Купчинская ул, д.25, Строение 2",214910,"г.Санкт-Петербург, Прилукская улица, дом 25, строение 1"
2837,"195256, Санкт-Петербург (г.), Науки (пр-кт.), д.33, Строение А",95956,"г.Санкт-Петербург, проспект Науки, дом 33, литера А"
2958,"195197, Санкт-Петербург (г.), Лабораторная (ул.), д.8/53, Строение А",82367,"г.Санкт-Петербург, Варваринская улица, дом 51, литера Б"
10245,"197373, Санкт-Петербург г, Авиаконструкторов пр-кт, д.37, Строение 2",189557,"г.Санкт-Петербург, Торики, садоводство ""АТП-71"", дом 37, литера А"
11140,"196634, Санкт-Петербург г, Полоцкая (Славянка) ул, д.4, Строение 3",215256,"г.Санкт-Петербург, Железноводская улица, дом 3а, строение 4"
4845,"Санкт-Петербург (г.), Пискарёвский (пр-кт.), д.155, Строение А",102672,"г.Санкт-Петербург, Пискарёвский проспект, дом 155, литера А"
8816,"197198, Санкт-Петербург г, Съезжинская ул, д.18-20",189540,"г.Санкт-Петербург, Торики, садоводство ""АТП-71"", дом 20, литера А"
1887,"194356, Санкт-Петербург (г.), Санкт-Петербург г, Асафьева ул, д.2 3,А",62456,"г.Санкт-Петербург, улица Бабушкина, дом 43, корпус 2, литера А"
5362,"198264, Санкт-Петербург (г.), Санкт-Петербург, ул. Генерала Кравченко, д.7,к.2,стр1",220305,"г.Санкт-Петербург, улица Генерала Кравченко, дом 7, корпус 1, строение 1"
5261,"195298, Санкт-Петербург г, Осипенко ул, д.3, Строение 2",214332,"г.Санкт-Петербург, Петровский проспект, дом 2, строение 3"
348,"199397, Санкт-Петербург г, Наличная ул, д.40, Строение 6",102211,"г.Санкт-Петербург, Наличная улица, дом 40, корпус 6, литера А"
11389,"196140, Санкт-Петербург г, Кокколевская (Пулковское) ул, д.7, Строение 2",217611,"город Павловск, тер. СНТ ""Павловское-2"", 7-я линия, дом 61, строение 1"
27,"198035, Санкт-Петербург (г.), Санкт-Петербург г, Степана Разина ул, д.8/231",135673,"г.Санкт-Петербург, улица Степана Разина, дом 8б/231"
12572,"191028, Санкт-Петербург г, Моховая ул, д.37",10645,"г.Санкт-Петербург, проспект Энгельса, дом 37, литера Б"
2727,"195274, Санкт-Петербург (г.), Культуры (пр-кт.), д.19, Строение 3",104474,"г.Санкт-Петербург, Светлановский проспект, дом 3, литера Б"
4377,"196657, Санкт-Петербург (г.), Колпино (г.), Пролетарская (ул.), д.62, Строение 2",219510,"г.Санкт-Петербург, Комендантский проспект, дом 66, корпус 6, строение 1"
4338,"196657, Санкт-Петербург г, Колпино г, Трудящихся б-р, д.37",62540,"г.Санкт-Петербург, проспект Непокорённых, дом 63, литера К35"
12600,"191015, Санкт-Петербург г, Таврическая ул, д.35",217003,"г.Санкт-Петербург, Республиканская улица, дом 35, строение 1"
0,"190008, Санкт-Петербург (г.), Санкт-Петербург г, Канонерская ул, д.6-8-10",56936,"г.Санкт-Петербург, Канонерская улица, дом 6-8-10, литера А"
5863,"198323, Санкт-Петербург г, Заречная (Горелово) ул, д.18",50109,"г.Санкт-Петербург, улица Чайковского, дом 83/7, литера А"
11004,"196627, Санкт-Петербург г, Ленсоветовский тер, д.33",10200,"г.Санкт-Петербург, Кожевенная линия, дом 33"
4260,"196657, Санкт-Петербург г, Колпино г, Раумская ул, д.17",82364,"г.Санкт-Петербург, улица Чайковского, дом 65-67, литера А"
2693,"195252, Санкт-Петербург (г.), Науки (пр-кт.), д.30, Строение 2",53326,"г.Санкт-Петербург, Садовая улица, дом 28-30, корпус 52, литера К52"
7789,"193230, Санкт-Петербург г, Крыленко ул, д.7, Строение 3",219198,"г.Санкт-Петербург, улица Салова, дом 31, строение 3"
3344,"198217, Санкт-Петербург г, Дачный пр-кт, д.31, Строение 1",219198,"г.Санкт-Петербург, улица Салова, дом 31, строение 3"
11508,"196601, Санкт-Петербург г, Пушкин г, Московская ул, д.2",56452,"г.Санкт-Петербург, 2-я Никитинская улица, дом 67, литера А"
2638,"195269, Санкт-Петербург (г.), Луначарского (пр-кт.), д.94, Строение 2",90846,"г.Санкт-Петербург, Большой Сампсониевский проспект, дом 94, корпус 3, литера А"
6774,"196240, Санкт-Петербург г, Пулковское ш, д.13, Строение 3",219427,"г.Санкт-Петербург, проспект Непокорённых, дом 63, корпус 13, строение 3"
7401,"196066, Санкт-Петербург (г.), Санкт-Петербург г, Типанова ул, д.4",79390,"г.Санкт-Петербург, 4-я линия В.О., дом 61, литера Б"
4523,"195213, Санкт-Петербург г, Заневский пр-кт, д.41",206823,"г.Санкт-Петербург, Лахта, Новая улица, дом 51, корпус 41"
11313,"196634, Санкт-Петербург г, Изборская (Славянка) ул, д.2, Строение 2",50629,"г.Санкт-Петербург, Синопская набережная, дом 66, строение 2"
9008,"197110, Санкт-Петербург (г.), Санкт-Петербург г, Петровский остров, д.5",218915,"г.Санкт-Петербург, Московский проспект, дом 71, корпус 5, строение 1"
1500,"Санкт-Петербург (г.), Лиственная (ул.), д.15, Строение 1",214069,"г.Санкт-Петербург, Лиственная улица, дом 15, корпус 1, строение 1"
1977,"195257, Санкт-Петербург (г.), Северный (пр-кт.), д.65, Строение 2",222433,"г.Санкт-Петербург, Заневский проспект, дом 65, корпус 3, строение 1"
9291,"198412, Санкт-Петербург г, Ломоносов г, Красноармейская ул, д.5",28898,"г.Санкт-Петербург, Октябрьская набережная, дом 84, корпус 5, литера А"
2716,"195274, Санкт-Петербург (г.), Культуры (пр-кт.), д.15, Строение 5",132081,"г.Санкт-Петербург, Витебский проспект, дом 16, литера Г5"
9145,"198516, Санкт-Петербург г, Петергоф г, Разведчика б-р, д.14, Строение 5",214737,"г.Санкт-Петербург, Трамвайный проспект, дом 14, строение 5"
3355,"198260, Санкт-Петербург г, Козлова ул, д.17, Строение 2",219674,"г.Санкт-Петербург, Лиговский проспект, дом 260, строение 2"
1660,"194292, Санкт-Петербург (г.), Санкт-Петербург г, Руднева ул, д.19-2 А",136926,"г.Санкт-Петербург, Старо-Паново, 2-я Заводская улица, дом 42, литера Г1"
9060,"Санкт-Петербург (г.), Санкт-Петербург г, Петровский пр-кт 12А, Петровская коса д.6 к.2",56626,"г.Санкт-Петербург, Коннолахтинский проспект, дом 12, корпус 2, строение 6"
9077,"197110, Санкт-Петербург (г), Константиновский (пр-кт), д.14-16",20859,"г.Санкт-Петербург, 15-я линия В.О., дом 72"
4853,"195279, Санкт-Петербург г, Ударников пр-кт, д.22, Строение 2",224346,"г.Санкт-Петербург, улица Салова, дом 53, корпус 3, строение 2"
12082,"192238, Санкт-Петербург г, Бухарестская ул, д.76, Строение 2",211821,"г.Санкт-Петербург, Кубинская улица, дом 76, корпус 7, строение 1"
6263,"198264, Санкт-Петербург г, Пограничника Гарькавого ул, д.28, Строение 3",211914,"г.Санкт-Петербург, проспект Металлистов, дом 28, строение 3"
11413,"196601, Санкт-Петербург г, Пушкин г, Набережная ул, д.22",221303,"г.Санкт-Петербург, Кирочная улица, дом 67, строение 1"
5900,"198328, Санкт-Петербург г, Доблести ул, д.24, Строение 2",215364,"г.Санкт-Петербург, Горелово, 2-й проезд, дом 26, строение 1"
5792,"198330, Санкт-Петербург г, Петергофское ш, д.1, Строение 3",215807,"г.Санкт-Петербург, Средний проспект В.О., дом 83, строение 3"
12415,"192284, Санкт-Петербург г, Будапештская ул, д.74, Строение 4",10335,"г.Санкт-Петербург, Будапештская улица, дом 74, корпус 4, литера А"
672,"199155, Санкт-Петербург г, КИМа пр-кт, д.11",92634,"г.Санкт-Петербург, улица Седова, дом 91, корпус 5, литера О"
7735,"193318, Санкт-Петербург г, Подвойского ул, д.14, Строение 3",216649,"г.Санкт-Петербург, 3-й Верхний переулок, дом 14, строение 1"
12374,"192242, Санкт-Петербург г, Белградская ул, д.6, Строение 6",213194,"г.Санкт-Петербург, Бобыльская улица, дом 6, строение 1"
913,"194363, Санкт-Петербург (г.), Санкт-Петербург г, Фёдора Абрамова ул, д.23-2",28836,"г.Санкт-Петербург, улица Бутлерова, дом 40, корпус 2, литера Б"
11106,"196601, Санкт-Петербург г, Пушкин г, Средняя ул, д.18",135707,"г.Санкт-Петербург, Суздальский проспект, дом 67а, литера Г1"
6858,"196191, Санкт-Петербург г, Новоизмайловский пр-кт, д.28, Строение 3А",22148,"г.Санкт-Петербург, Кронверкский проспект, дом 61/28, литера Б"
705,"199053, Санкт-Петербург г, Кадетская линия, д.3",6354,"г.Санкт-Петербург, 3-я линия 1-й половины, дом 91, литера А"
12763,"191028, Санкт-Петербург г, Фурштатская ул, д.22",10431,"г.Санкт-Петербург, Садовая улица, дом 28-30, корпус 22, литера К22"
7382,"196158, Санкт-Петербург г, Пулковская ул, д.5",37319,"г.Санкт-Петербург, Земледельческая улица, дом 5"
2939,"195276, Санкт-Петербург (г.), Культуры (пр-кт.), д.29, Строение 5",65887,"г.Санкт-Петербург, проспект Культуры, дом 29, корпус 5, литера А"
5434,"198320, Санкт-Петербург г, Красное Село г, Бронетанковая ул, д.13, Строение 2",221316,"г.Санкт-Петербург, улица Брянцева, дом 13, корпус 2, строение 1"
10709,"197374, Санкт-Петербург г, Приморский пр-кт, д.143, Строение 3",38820,"г.Санкт-Петербург, Северный проспект, дом 73, корпус 3"
9940,"197350, Санкт-Петербург (г.), Санкт-Петербург г, Глухарская ул., д.33,3",206751,"г.Санкт-Петербург, Лахта, Новая улица, дом 51, корпус 73"
6385,"198327, Санкт-Петербург г, Красное Село г, Хвойный тер, д.115",137030,"г.Санкт-Петербург, Старо-Паново, Таллинское шоссе, дом 184, литера Г1"
8978,"197136, Санкт-Петербург г, Бармалеева ул, д.30",84126,"г.Санкт-Петербург, Братская улица, дом 30"
2848,"195220, Санкт-Петербург (г.), Бутлерова (ул.), д.9, Строение 4",132887,"г.Санкт-Петербург, Горелово, Колхозная улица, дом 21, литера Г4"
4040,"196652, Санкт-Петербург (г.), Колпино (г.), Загородная (ул.), д.41 к.4 с.1",25262,"г.Санкт-Петербург, улица Жака Дюкло, дом 66"
373,"199226, Санкт-Петербург г, Кораблестроителей ул, д.19, Строение 3",108888,"г.Санкт-Петербург, Октябрьская набережная, дом 26, корпус 3, литера Д"
4444,"196643, Санкт-Петербург г, Фанерная ул, д.3",103700,"г.Санкт-Петербург, Арсенальная улица, дом 66, литера Г3"
12902,"191180, Санкт-Петербург г, Бородинская ул, д.12/31",101043,"г.Санкт-Петербург, Бородинская улица, дом 12/31, литера А"
6480,"197760, Санкт-Петербург (г.), Санкт-Петербург г, Кронштадт г, Широкая, д.20 А",52622,"г.Санкт-Петербург, 7-я Красноармейская улица, дом 20, литера Б"
3583,"198096, Санкт-Петербург г, Автовская ул, д.11",212881,"г.Санкт-Петербург, Малоохтинский проспект, дом 80/2, строение 11"
4561,"195279, Санкт-Петербург г, Энтузиастов пр-кт, д.22, Строение 3, литер А",136229,"г.Санкт-Петербург, проспект Энергетиков, дом 53, литера Г3"
3128,"198216, Санкт-Петербург г, Новаторов б-р, д.7",224078,"г.Санкт-Петербург, Бобруйская улица, дом 7, строение 3"
1598,"194021, Санкт-Петербург (г.), Санкт-Петербург г, 2 Муринский пр, д.34",85372,"г.Санкт-Петербург, набережная реки Фонтанки, дом 40/68"
3628,"198255, Санкт-Петербург г, Ветеранов пр-кт, д.1, Строение 2",19108,"г.Санкт-Петербург, Новоизмайловский проспект, дом 83, литера А"
11933,"192283, Санкт-Петербург г, Малая Балканская ул, д.42, Строение 2",19500,"г.Санкт-Петербург, Белградская улица, дом 42, корпус 1, литера А"
8238,"193231, Санкт-Петербург г, Подвойского ул, д.29, Строение 2",96867,"г.Санкт-Петербург, Средний проспект В.О., дом 31"
2171,"195221, Санкт-Петербург (г.), Металлистов (пр-кт.), д.86, Строение 2",134340,"г.Санкт-Петербург, Новоизмайловский проспект, дом 21, литера Г4"
410,"199155, Санкт-Петербург г, Морская наб, д.37, Строение 2",11777,"г.Санкт-Петербург, Морская набережная, дом 37, корпус 1, литера Б"
2348,"195271, Санкт-Петербург (г.), Замшина (ул.), д.62, Строение 2",93855,"г.Санкт-Петербург, Заповедная улица, дом 62, корпус 3, литера Н"
12116,"192241, Санкт-Петербург г, Белы Куна ул, д.17, Строение 3",212134,"г.Санкт-Петербург, 1-я Берёзовая аллея, дом 17, строение 3"
4544,"195030, Санкт-Петербург г, Наставников пр-кт, д.41, Строение 4, литер А",206823,"г.Санкт-Петербург, Лахта, Новая улица, дом 51, корпус 41"
359,"199406, Санкт-Петербург г, Беринга ул, д.22, Строение 2",53839,"г.Санкт-Петербург, улица Беринга, дом 22, корпус 2, литера Б"
3125,"198097, Санкт-Петербург (г.)",135365,"г.Санкт-Петербург, Северный проспект, дом 80, литера Г3"
7186,"196070, Санкт-Петербург г, Бассейная ул, д.31",83798,"г.Санкт-Петербург, Садовая улица, дом 28-30, корпус 60"
1280,"194354, Санкт-Петербург (г.), Санкт-Петербург г, 2й Муринский пр-т, д.10 2, А",213617,"г.Санкт-Петербург, Октябрьская набережная, дом 104, корпус 40, строение 2"
8950,"197110, Санкт-Петербург г, Морской пр-кт, д.26",54044,"г.Санкт-Петербург, Большая Озёрная улица, дом 26"
11837,"192288, Санкт-Петербург (г.), Димитрова (ул.), д.39, Строение 2",210860,"г.Санкт-Петербург, улица Димитрова, дом 39, корпус 4, строение 1"
5320,"195279, Санкт-Петербург г, Ударников пр-кт, д.31",219198,"г.Санкт-Петербург, улица Салова, дом 31, строение 3"
10138,"197374, Санкт-Петербург г, Туристская ул, д.4, Строение 2",62660,"г.Санкт-Петербург, Тверская улица, дом 4"
1671,"194362, Санкт-Петербург (г.), Санкт-Петербург г, Приозерское ш, д.16-2 А",188181,"г.Санкт-Петербург, Суворовский проспект, дом 40а, литера Б"
10940,"196607, Санкт-Петербург г, Пушкин г, Ленинградская ул, д.77, Строение б",89495,"г.Санкт-Петербург, Индустриальный проспект, дом 67, литера Г7"
1375,"194291, Санкт-Петербург (г.), Культуры (пр-кт.), д.14, Строение 2",220011,"г.Санкт-Петербург, Железнодорожный проспект, дом 14, корпус 2, строение 1"
9412,"198516, Санкт-Петербург г, Петергоф г, Разводная ул, д.5/1",140194,"г.Санкт-Петербург, Авангардная улица, дом 16, корпус 5"
11235,"196657, Санкт-Петербург г, Лангеловская (Новая Ижора) ул, д.8",6006,"г.Санкт-Петербург, 8-я линия В.О., дом 67, литера Б"
12930,"191186, Санкт-Петербург г, Искусств, д.2",23763,"г.Санкт-Петербург, Складской проезд, дом 2, строение 1"
10697,"197373, Санкт-Петербург (г.), Долгоозёрная (ул.), д.5, Строение 2",213409,"г.Санкт-Петербург, Кубинская улица, дом 73, корпус 2, строение 5"
4572,"Санкт-Петербург (г.), Пейзажная (ул.), д.8",12149,"г.Санкт-Петербург, Граничная улица, дом 8"
