id,address,target_building_id_test,target_address,target_building_id,weighted_similarity
94,"Жуковского , д.22",198600,"г.Санкт-Петербург, улица Жуковского, дом 22",108064,0
93,"Лебедева Академика, д.18",76738,"г.Санкт-Петербург, улица Академика Лебедева, дом 18, литера В",44169,0
92,"Маршала Казакова, д.1",81918,"г.Санкт-Петербург, улица Маршала Казакова",200477,0
91,"Кирочная , д.33",11107,"г.Санкт-Петербург, Кирочная улица, дом 33, литера А",11107,0
90,"Казначейская, д.1/61",12294,"г.Санкт-Петербург, Казначейская улица, дом 1/61, литера А",12294,0
89,"Ветеранов, д.87",40748,"г.Санкт-Петербург, проспект Ветеранов, дом 87, литера А",40748,0
88,"А. Блока, д.8",58811,"г.Санкт-Петербург, улица Александра Блока, дом 3, литера А",1649,0
87,"1 Красноармейская, д.14",75245,"г.Санкт-Петербург, 2-я Красноармейская улица, дом 14, литера А",13943,0
86,"Морская наб., д.31",108714,"город Ломоносов, Морская улица, дом 31, литера А",57243,0
85,"Боровая, д.46",29068,"г.Санкт-Петербург, Боровая улица, дом 46",199753,0
84,"191002, Санкт-Петербург г, Реки Фонтанки наб, д.62",61998,"г.Санкт-Петербург, набережная реки Фонтанки, дом 62, литера А",61998,0
101,"Кирилловская , д.13",102583,"г.Санкт-Петербург, Кирилловская улица, дом 13, литера А",102583,0
102,"Трамвайный, д.15",5164,"г.Санкт-Петербург, Трамвайный проспект, дом 15, корпус 1, литера А",5164,0
103,"Большой пр В.О., д.10",65921,"г.Санкт-Петербург, Большой проспект П.С., дом 10, литера А",14596,0
113,"Восстания, д.42а",78564,"г.Санкт-Петербург, улица Восстания, дом 42а, литера А",4510,0
120,"Морская наб., д.9",87405,"г.Санкт-Петербург, Морская улица, дом 9",124718,0
119,"7 Красноармейская, д.9",2874,"г.Санкт-Петербург, 2-я Красноармейская улица, дом 3",44939,0
118,"10 линия, д.55",7646,"г.Санкт-Петербург, 10-я линия В.О., дом 55",56565,0
117,"Декабристов, д.46",110962,"г.Санкт-Петербург, улица Декабристов, дом 46, литера А",110962,0
116,"Белградская, д.18",96496,"г.Санкт-Петербург, Белградская улица, дом 18, литера А",96496,0
115,"4 Советская , д.37а",56649,"г.Санкт-Петербург, 4-я Советская улица, дом 37а, литера А",69474,0
114,"Таврическая, д.43",26916,"г.Санкт-Петербург, Таврическая улица, дом 43, литера А",26916,0
112,"9 линия, д.50",20847,"г.Санкт-Петербург, 9-я линия В.О., дом 50, литера А",20847,0
104,"Маяковского , д.52",25082,"г.Санкт-Петербург, улица Маяковского, дом 52, литера А",25082,0
111,"Димитрова, д.26",1755,"г.Санкт-Петербург, улица Димитрова, дом 26, литера А",1755,0
110,"Садовая, д.112-114",90015,"г.Санкт-Петербург, Садовая улица, дом 112-114, литера А",90015,0
109,"Червоного Казачества, д.4",21562,"г.Санкт-Петербург, улица Червонного Казачества, дом 4, литера А",21562,0
108,"Чайковского , д.36",114246,"г.Санкт-Петербург, улица Чайковского, дом 36, литера А",114246,0
107,"Маршала Захарова, д.28",108194,"г.Санкт-Петербург, улица Маршала Захарова, дом 28, литера А",108194,0
106,"Ветеранов, д.71",5511,"г.Санкт-Петербург, проспект Ветеранов, дом 71, литера А",5511,0
105,"Дальневосточный, д.46/28",94888,"г.Санкт-Петербург, Дальневосточный проспект, дом 46/28, литера Д",94888,0
327,"Россия, Санкт-Петербург, Парашютная улица, 33к1",78404,"г.Санкт-Петербург, Парашютная улица",221355,0
