Unnamed: 0,address,target_building_id,target_address
5739,"198264, Санкт-Петербург г, Пограничника Гарькавого ул, д.37, Строение 2",135614,"г.Санкт-Петербург, Горелово, Социалистическая улица, дом 82, литера Г2"
8427,"192171, Санкт-Петербург г, Бабушкина ул, д.42, Строение 3",215437,"г.Санкт-Петербург, Парашютная улица, дом 42, корпус 3, строение 1"
4361,"196653, Санкт-Петербург, Вавилова ул, д.6",112266,"г.Санкт-Петербург, Челябинская улица, дом 67"
7618,"193230, Санкт-Петербург (г.), Дальневосточный (пр-кт.), д.33 2",67297,"г.Санкт-Петербург, улица Черняховского, дом 33"
9656,"197350, Санкт-Петербург г, Королёва пр-кт, д.72, Строение 1",87528,"г.Санкт-Петербург, проспект Стачек, дом 47, строение 72"
8823,"197101, Санкт-Петербург г, Каменноостровский пр-кт, д.18/11",217889,"г.Санкт-Петербург, Кантемировская улица, дом 11, строение 1"
1340,"194355, Санкт-Петербург (г.), Санкт-Петербург г, Суздальский пр-кт, д.5-2 А",132571,"г.Санкт-Петербург, Заневский проспект, дом 43, литера Г5"
3220,"198216, Санкт-Петербург г, Народного ополчения пр-кт, д.11",69203,"г.Санкт-Петербург, Новгородская улица, дом 11, литера Г1"
8921,"197198, Санкт-Петербург г, Татарский пер, д.8",784,"г.Санкт-Петербург, Масляный переулок, дом 8"
5139,"195279, Санкт-Петербург г, Ударников пр-кт, д.27, Строение 3",221862,"г.Санкт-Петербург, 3-й Рыбацкий проезд, дом 3, корпус 3, строение 1"
4530,"195213, Санкт-Петербург г, Заневский пр-кт, д.57, Строение 2, литер А",23806,"г.Санкт-Петербург, 3-я линия 1-й половины, дом 53, литера Б"
517,"199004, Санкт-Петербург г, Тучков пер, д.17",30765,"г.Санкт-Петербург, Витебский проспект, дом 91, литера А"
12777,"191186, Санкт-Петербург г, Конюшенная Б. ул, д.7",89299,"г.Санкт-Петербург, Большая Конюшенная улица, дом 7"
5974,"198330, Санкт-Петербург г, Ленинский пр-кт, д.97, Строение 2",133505,"г.Санкт-Петербург, Ленинский проспект, дом 81, корпус 3, литера А"
6971,"196247, Санкт-Петербург (г.), Санкт-Петербург г, Новоизмайловский пр-кт, д.25",29553,"г.Санкт-Петербург, проспект Непокорённых, дом 63, литера К25"
8010,"192177, Санкт-Петербург г, Караваевская ул, д.2, Строение 2",214760,"г.Санкт-Петербург, 2-я Семёновская улица, дом 21, строение 1"
399,"199226, Санкт-Петербург г, Наличная ул, д.36, Строение 8",209306,"г.Санкт-Петербург, Наличная улица, дом 26, корпус 8, строение 1"
8869,"197046, Санкт-Петербург г, Троицкая пл, д.1",101558,"г.Санкт-Петербург, улица Седова, дом 71, корпус 3, строение 1"
9319,"198517, Санкт-Петербург г, Петергоф г, Ропшинское ш, д.8",4328,"г.Санкт-Петербург, Шипкинский переулок, дом 8"
12609,"191014, Санкт-Петербург г, Рылеева ул, д.22",84518,"г.Санкт-Петербург, 11-я линия В.О., дом 22"
6522,"197760, Санкт-Петербург г, Кронштадт г, Зосимова ул, д.4",48387,"г.Санкт-Петербург, улица Академика Харитона, дом 7, строение 4"
155,"196084, Санкт-Петербург (г.), Санкт-Петербург г, Московский проспект, д.75, лит А",71937,"г.Санкт-Петербург, Московский проспект, дом 75, литера А"
6020,"198332, Санкт-Петербург г, Маршала Захарова ул, д.22, Строение 4",215256,"г.Санкт-Петербург, Железноводская улица, дом 3а, строение 4"
12812,"191119, Санкт-Петербург г, Марата ул, д.79",6763,"г.Санкт-Петербург, Садовая улица, дом 79, литера Б"
7345,"196135, Санкт-Петербург (г.), Санкт-Петербург г, Ю. Гагарина, д.21",102870,"г.Санкт-Петербург, Глиняная улица, дом 21"
8293,"193318, Санкт-Петербург г, Коллонтай ул, д.4, Строение 2",78046,"г.Санкт-Петербург, Комендантский проспект, дом 33, корпус 4, литера Б"
10097,"197372, Санкт-Петербург г, Комендантский пр-кт, д.28, Строение 3",211914,"г.Санкт-Петербург, проспект Металлистов, дом 28, строение 3"
10902,"196631, Санкт-Петербург г, Волхонское ш, д.44",2205,"г.Санкт-Петербург, Ржевская улица, дом 44"
10994,"196620, Санкт-Петербург г, Павловск г, Березовая ул, д.22",60972,"г.Санкт-Петербург, Бестужевская улица, дом 22, литера Б"
10598,"197372, Санкт-Петербург г, Долгоозерная ул, д.11, Строение 2",79441,"г.Санкт-Петербург, улица Седова, дом 11а, строение 1"
4138,"196650, Санкт-Петербург г, Колпино г, Павловская ул, д.31",35222,"г.Санкт-Петербург, проспект Непокорённых, дом 63, литера К50"
2027,"195269, Санкт-Петербург (г.), Брянцева (ул.), д.2, Строение 3",219223,"г.Санкт-Петербург, Брантовская дорога, дом 3, строение 2"
5096,"195298, Санкт-Петербург г, Ленская ул, д.16, Строение 4",12102,"г.Санкт-Петербург, Ленская улица, дом 16, корпус 3, литера Б"
4056,"196655, Санкт-Петербург г, Колпино г, Тазаева ул, д.22",134358,"г.Санкт-Петербург, Новоизмайловский проспект, дом 67, корпус 2, литера Г5"
1269,"194354, Санкт-Петербург (г.), Санкт-Петербург г, Северный пр-кт, д.10 3, А",213617,"г.Санкт-Петербург, Октябрьская набережная, дом 104, корпус 40, строение 2"
3198,"198215, Санкт-Петербург г, Подводника Кузьмина ул, д.40",31757,"г.Санкт-Петербург, Железноводская улица, дом 40"
5842,"198206, Санкт-Петербург (г.), Красное Село (г.), ул. Летчика Лихолетова, д.4, к.8,с.1",211868,"г.Санкт-Петербург, улица Генерала Хрулёва, дом 8, корпус 4, строение 1"
1488,"194291, Санкт-Петербург (г.), Руднева (ул.), д.3, Строение 3",195635,"г.Санкт-Петербург, Горелово, садоводство ""Дружба-1"", 3-я аллея, дом 42, литера А"
8897,"197022, Санкт-Петербург г, Профессора Попова ул, д.12",137776,"г.Санкт-Петербург, Берёзовая аллея, дом 12, корпус 3"
7201,"196240, Санкт-Петербург г, 5-й Предпортовый проезд, д.4, Строение 2А",191263,"г.Санкт-Петербург, Торики, садоводство ""Хладокомбинат 4-5"", дом 62, литера А"
9416,"198515, Санкт-Петербург г, Фронтовая ул, д.8",25059,"г.Санкт-Петербург, улица Фучика, дом 8"
6268,"198328, Санкт-Петербург г, Героев пр-кт, д.23",214331,"город Сестрорецк, тер. СНТ ""Разлив"", 3-й проезд, дом 23, строение 1"
4308,"196650, Санкт-Петербург г, Колпино г, Павловская ул, д.39",3424,"г.Санкт-Петербург, Кантемировская улица, дом 39, литера Б"
1067,"194355, Санкт-Петербург (г.), Санкт-Петербург г, Просвещения пр-кт, д.5 2, А",132571,"г.Санкт-Петербург, Заневский проспект, дом 43, литера Г5"
8621,"193079, Санкт-Петербург г, Народная ул, д.2, Строение 2",55132,"г.Санкт-Петербург, 2-я Семёновская улица, дом 30, литера А"
3530,"198261, Санкт-Петербург г, Стойкости ул, д.41, Строение 2",212187,"г.Санкт-Петербург, Старая улица, дом 41, строение 2"
6539,"197762, Санкт-Петербург г, Кронштадт г, Лазаревский пер, д.4",97188,"г.Санкт-Петербург, Красногвардейская площадь, дом 4, литера А"
669,"199106, Санкт-Петербург г, 19-я В.О. линия, д.22, Строение 4",189373,"г.Санкт-Петербург, Торики, садоводство ""Дружный-1"", 4-я линия, дом 19, литера А"
5307,"195298, Санкт-Петербург г, Осипенко ул, д.6",8327,"г.Санкт-Петербург, 6-й Верхний переулок, дом 3, литера А"
9554,"197373, Санкт-Петербург (г.), Планерная (ул.), д.91, 2, 1",220346,"г.Санкт-Петербург, Планерная улица, дом 91, корпус 1, строение 1"
2954,"195197, Санкт-Петербург (г.), Кондратьевский (пр-кт.), д.49, Строение А",209266,"г.Санкт-Петербург, Юнтоловский проспект, дом 49, корпус 1, строение 1"
756,"199155, Санкт-Петербург г, Каховского пер, д.2",78487,"г.Санкт-Петербург, Северный проспект, дом 91, корпус 5, литера А"
10928,"196607, Санкт-Петербург г, Пушкин г, Ленинградская ул, д.43",185761,"г.Санкт-Петербург, Бестужевская улица, дом 43, литера В"
11853,"192288, Санкт-Петербург г, Ярослава Гашека ул, д.26, Строение 2",217496,"г.Санкт-Петербург, Студенческая улица, дом 26, корпус 2, строение 1"
8359,"193168, Санкт-Петербург г, Антонова-Овсеенко ул, д.5, Строение 4",218278,"г.Санкт-Петербург, Политехническая улица, дом 3, корпус 5, строение 4"
4229,"196650, Санкт-Петербург, Павловская ул, д.56",16228,"г.Санкт-Петербург, Варваринская улица, дом 56"
2961,"195297, Санкт-Петербург (г.), Светлановский (пр-кт.), д.68, Строение 2",214881,"г.Санкт-Петербург, Кондратьевский проспект, дом 68, корпус 3, строение 1"
11519,"196602, Санкт-Петербург г, Пушкин г, Артиллерийская ул, д.7/20",219947,"г.Санкт-Петербург, Комендантский проспект, дом 66, корпус 7, строение 1"
5825,"198330, Санкт-Петербург г, Маршала Захарова ул, д.27, Строение 4",133935,"г.Санкт-Петербург, Горелово, улица Можайского, дом 30, литера Г4"
9613,"197227, Санкт-Петербург г, Серебристый б-р, д.11, Строение 2",91109,"г.Санкт-Петербург, Кондратьевский проспект, дом 72"
1605,"194362, Санкт-Петербург (г.), Санкт-Петербург г, Юкковское шоссе, д.10, 2",213617,"г.Санкт-Петербург, Октябрьская набережная, дом 104, корпус 40, строение 2"
1636,"194356, Санкт-Петербург (г.), Санкт-Петербург г, Есенина ул, д.26 3, А",58468,"г.Санкт-Петербург, Косая линия, дом 16, корпус 43, литера Г49"
5600,"198329, Санкт-Петербург г, Добровольцев ул, д.22, Строение 2",215820,"г.Санкт-Петербург, Средний проспект В.О., дом 83, строение 2"
9489,"197375, Санкт-Петербург (г.), Реки Каменки (наб.), д.11 3",103434,"г.Санкт-Петербург, набережная реки Мойки, дом 74"
823,"194017, Санкт-Петербург (г.), Санкт-Петербург г, Энгельса пр-кт, д.65-2 А",102904,"г.Санкт-Петербург, Железноводская улица, дом 40, литера Г"
8905,"197101, Санкт-Петербург г, Монетная Б. ул, д.32",212626,"г.Санкт-Петербург, Бассейная улица, дом 32, строение 1"
8860,"197101, Санкт-Петербург (г.), Каменноостровский (пр-кт.), д.25/2, Строение А",217419,"муниципальный округ Горелово, тер. СНТ ""АТП-71"", Вишнёвая улица, дом 25, строение 1"
469,"199226, Санкт-Петербург г, Мичманская ул, д.2, Строение 2",82080,"г.Санкт-Петербург, 2-я Семёновская улица, дом 26"
1284,"194354, Санкт-Петербург (г.), Санкт-Петербург г, Северный пр-кт, д.6-2 А",132499,"г.Санкт-Петербург, Дунайский проспект, дом 64, корпус 2, литера Г6"
8562,"192012, Санкт-Петербург г, Грибакиных ул, д.2, Строение 3",215107,"г.Санкт-Петербург, улица Вадима Шефнера, дом 12, корпус 3, строение 1"
3847,"198184, Санкт-Петербург (г.), Санкт-Петербург г, Канонерский остров, д.20 лит. А",11316,"г.Санкт-Петербург, Комендантский проспект, дом 20, корпус 3, литера А"
12744,"191186, Санкт-Петербург г, Грибоедова Канала наб, д.18-20",54435,"г.Санкт-Петербург, 11-я Красноармейская улица, дом 18-20, литера А"
10746,"197343, Санкт-Петербург (г.), Серебристый (б-р.), д.25, Строение 2",222571,"г.Санкт-Петербург, Волго-Донской проспект, дом 25, строение 4"
754,"199155, Санкт-Петербург, Кима пр-кт, д.1",92634,"г.Санкт-Петербург, улица Седова, дом 91, корпус 5, литера О"
297,"190000, Санкт-Петербург г, Почтамтская ул, д.13",16306,"г.Санкт-Петербург, 1-я Красноармейская улица, дом 13"
2240,"195221, Санкт-Петербург (г.), Полюстровский (пр-кт.), д.25, Строение 2",222587,"г.Санкт-Петербург, Волго-Донской проспект, дом 25, строение 3"
1616,"194362, Санкт-Петербург (г.), Санкт-Петербург г, Юкковское (Осиновая Роща) ш, д.10-4",88112,"г.Санкт-Петербург, Пулковское шоссе, дом 40, корпус 4, литера Б"
2661,"195427, Санкт-Петербург (г.), Светлановский (пр-кт.), д.46, Строение 2",67773,"г.Санкт-Петербург, Светлановский проспект, дом 46, корпус 1, литера Б"
4239,"196650, Санкт-Петербург г, Колпино г, Павловская ул, д.56",72035,"г.Санкт-Петербург, Канонерский остров, дом 56, литера А"
5219,"195213, Санкт-Петербург г, Гранитная ул, д.54, Строение 2",136134,"г.Санкт-Петербург, проспект Шаумяна, дом 54, литера Г3"
9032,"197198, Санкт-Петербург г, Пушкарская Б. ул, д.29, Строение пом. 1-Н",189549,"г.Санкт-Петербург, Торики, садоводство ""АТП-71"", дом 29, литера А"
6044,"198332, Санкт-Петербург г, Маршала Казакова ул, д.28, Строение 2",90161,"г.Санкт-Петербург, Садовая улица, дом 28-30, корпус 32, литера К32"
8925,"197198, Санкт-Петербург (г.), Кронверкский (пр-кт.), д.73/39, Строение А",50527,"г.Санкт-Петербург, Кронверкский проспект, дом 73/39, литера А"
10871,"196627, Санкт-Петербург (г.), Шушары (п.), Ленсоветовский, д.35",27764,"г.Санкт-Петербург, Балтийская улица, дом 35"
3312,"198215, Санкт-Петербург г, Дачный пр-кт, д.14, Строение 2",214941,"г.Санкт-Петербург, Трамвайный проспект, дом 14, строение 3"
5997,"198332, Санкт-Петербург г, Кузнецова пр-кт, д.18, Строение 2",218658,"г.Санкт-Петербург, улица Композиторов, дом 32, строение 1"
11432,"196608, Санкт-Петербург г, Пушкин г, Октябрьский б-р, д.18/40",79212,"г.Санкт-Петербург, Софийская улица, дом 40, корпус 6, литера Б"
447,"199226, Санкт-Петербург г, Кораблестроителей ул, д.22, Строение 3",108888,"г.Санкт-Петербург, Октябрьская набережная, дом 26, корпус 3, литера Д"
328,"199004, Санкт-Петербург г, Волховский пер, д.6",140843,"г.Санкт-Петербург, 6-й Верхний переулок, дом 9, литера А"
10382,"197372, Санкт-Петербург (г.), Богатырский пр., д.60, 5, А",136612,"г.Санкт-Петербург, Володарский, Волхонское шоссе, дом 70/60, литера Г5"
10527,"197372, Санкт-Петербург (г.), Богатырский пр., д.39, 2, А",50527,"г.Санкт-Петербург, Кронверкский проспект, дом 73/39, литера А"
12475,"192241, Санкт-Петербург (г.), Турку (ул.), д.28, Строение 4",223445,"г.Санкт-Петербург, Полюстровский проспект, дом 28, строение 4"
2546,"195276, Санкт-Петербург (г.), Демьяна Бедного (ул.), д.30, Строение 7",109442,"г.Санкт-Петербург, улица Демьяна Бедного, дом 30, корпус 7, литера А"
991,"194017, Санкт-Петербург (г.), Санкт-Петербург г, Гаврская ул, д.9",81005,"г.Санкт-Петербург, Кондратьевский проспект, дом 40, корпус 9, литера А"
5386,"198205, Санкт-Петербург г, Партизана Германа ул, д.21, Строение 2",136430,"г.Санкт-Петербург, Горелово, 1-й проезд, дом 21, литера Г2"
8886,"197136, Санкт-Петербург г, Плуталова ул, д.9",20828,"г.Санкт-Петербург, Бармалеева улица, дом 9"
9884,"197349, Санкт-Петербург г, Парашютная ул, д.22, Строение 2",132603,"г.Санкт-Петербург, Зверинская улица, дом 21-23, литера Г4"
9581,"197342, Санкт-Петербург г, Черной речки наб, д.31",76964,"г.Санкт-Петербург, набережная Чёрной речки, дом 31, литера А"
545,"199406, Санкт-Петербург г, Гаванская ул, д.24",110281,"г.Санкт-Петербург, Бухарестская улица, дом 24"
5768,"198330, Санкт-Петербург г, Петергофское ш, д.7, Строение 2",214562,"г.Санкт-Петербург, набережная реки Волковки, дом 7, строение 3"
7431,"196143, Санкт-Петербург г, Ленсовета ул, д.49, Строение 2А",92266,"г.Санкт-Петербург, Синявинская улица, дом 12/49, литера Б"
1126,"194354, Санкт-Петербург (г.), Санкт-Петербург г, Луначарского пр-кт, д.19 2, А",92494,"г.Санкт-Петербург, Пионерская улица, дом 43, корпус 2, литера Б"
1225,"194352, Санкт-Петербург (г.), Санкт-Петербург г, Мориса Тореза, д.104 2, А",45121,"г.Санкт-Петербург, Октябрьская набережная, дом 104, корпус 41, литера А"
7987,"193315, Санкт-Петербург г, Тельмана ул, д.45, Строение 2",218463,"г.Санкт-Петербург, Октябрьская набережная, дом 34, корпус 5, строение 1"
7451,"196128, Санкт-Петербург (г.), Санкт-Петербург, пл. Чернышевского, д.10",65047,"г.Санкт-Петербург, Каменноостровский проспект, дом 10, литера Б"
1464,"194352, Санкт-Петербург (г.), Художников (пр-кт.), д.39, Строение 2",40412,"г.Санкт-Петербург, Железнодорожный проспект, дом 40, корпус 2, строение 1"
3246,"198215, Санкт-Петербург г, Счастливая ул, д.11",196465,"г.Санкт-Петербург, Нефтяная дорога, дом 11, литера Г15"
4207,"196657, Санкт-Петербург г, Колпино г, Металлургов ул, д.4, Строение 2",219011,"г.Санкт-Петербург, Заневский проспект, дом 67, корпус 4, строение 1"
3187,"198095, Санкт-Петербург г, Промышленная ул, д.24",70214,"г.Санкт-Петербург, Трамвайный проспект, дом 24, литера А"
9820,"197183, Санкт-Петербург (г.), Санкт-Петербург г, Школьная ул, д.8 А",189598,"г.Санкт-Петербург, Торики, садоводство ""АТП-71"", дом 8, литера А"
5196,"195030, Санкт-Петербург г, Ударников пр-кт, д.56, Строение 2",206818,"г.Санкт-Петербург, Лахта, Новая улица, дом 51, корпус 56"
10346,"197374, Санкт-Петербург г, Савушкина ул, д.123, Строение 2",92081,"г.Санкт-Петербург, улица Савушкина, дом 123, корпус 4, литера А"
1624,"194352, Санкт-Петербург (г.), Санкт-Петербург г, Руднева ул, д.28-3 А",215467,"г.Санкт-Петербург, Парашютная улица, дом 43, строение 3"
1768,"194214, Санкт-Петербург (г.), Санкт-Петербург г, Ярославский пр-кт, д.66 2, А",220011,"г.Санкт-Петербург, Железнодорожный проспект, дом 14, корпус 2, строение 1"
10189,"197373, Санкт-Петербург г, Комендантский пр-кт, д.34, Строение 2",68711,"г.Санкт-Петербург, Комендантский проспект, дом 34, корпус 1, литера Д"
10529,"197374, Санкт-Петербург г, Школьная ул, д.128, Строение 2",192566,"г.Санкт-Петербург, Торики, садоводство ""Дружный-2"", Центральная аллея, дом 73, литера А"
305,"190103, Санкт-Петербург г, 8-я Красноармейская ул, д.16",85089,"г.Санкт-Петербург, 8-я Красноармейская улица, дом 15-17, литера Б"
2447,"195267, Санкт-Петербург (г.), Гражданский (пр-кт.), д.124, Строение 4",32706,"г.Санкт-Петербург, Гражданский проспект, дом 124, корпус 4, литера А"
