Unnamed: 0,address,target_building_id,target_address
1245,"194356, Санкт-Петербург (г.), Санкт-Петербург г, Хошимина ул, д.13 3, А",58468,"г.Санкт-Петербург, Косая линия, дом 16, корпус 43, литера Г49"
12793,"191014, Санкт-Петербург г, Ковенский пер, д.15",11120,"г.Санкт-Петербург, проспект Энергетиков, дом 15"
12510,"197720, Санкт-Петербург г, Пляжевая ул, д.14",54935,"г.Санкт-Петербург, 7-й Предпортовый проезд, дом 14, литера Б"
2194,"195276, Санкт-Петербург (г.), Просвещения (пр-кт.), д.68, Строение 4",132283,"г.Санкт-Петербург, Гражданский проспект, дом 26, корпус 4, литера А"
12707,"191040, Санкт-Петербург, Лиговский пр-кт, д.89/20",32992,"г.Санкт-Петербург, Ленинский проспект, дом 89, литера А"
7338,"196135, Санкт-Петербург г, Фрунзе ул, д.23",38720,"г.Санкт-Петербург, улица Ванеева, дом 23"
12,"190005, Санкт-Петербург г, Измайловский пр-кт, д.7",46677,"г.Санкт-Петербург, Володарский, Черниговский переулок, дом 7"
4150,"196641, Санкт-Петербург г, Максима Горького ул, д.4",9406,"г.Санкт-Петербург, Софийская улица, дом 66, литера Г4"
9427,"198412, Санкт-Петербург г, Ломоносов г, Дегтярева ул, д.1/7",165504,"г.Санкт-Петербург, Петергофское шоссе, дом 84, корпус 12, литера А"
56,"190005, Санкт-Петербург (г.), Санкт-Петербург г, 1-я Красноармейская, д.12 лит А",83657,"г.Санкт-Петербург, 12-я линия В.О., дом 25, литера Ц"
4664,"195279, Санкт-Петербург г, Передовиков ул, д.29, Строение 3",211737,"г.Санкт-Петербург, улица Руставели, дом 29, строение 3"
1899,"194362, Санкт-Петербург (г.), Санкт-Петербург г, Кооперативная ул, д.8 2, А",188181,"г.Санкт-Петербург, Суворовский проспект, дом 40а, литера Б"
5868,"198218, Санкт-Петербург г, Урицкого (Сергиево) ул, д.14",214941,"г.Санкт-Петербург, Трамвайный проспект, дом 14, строение 3"
10457,"197372, Санкт-Петербург г, Стародеревенская ул, д.20, Строение 3",210774,"г.Санкт-Петербург, Ковалёвская улица, дом 20, корпус 3, строение 1"
531,"199406, Санкт-Петербург г, Гаванская ул, д.37",32941,"г.Санкт-Петербург, Братская улица, дом 37"
1563,"194352, Санкт-Петербург (г.), Санкт-Петербург г, Придорожная аллея, д.9-3",195634,"г.Санкт-Петербург, Горелово, садоводство ""Дружба-1"", 3-я аллея, дом 41, литера А"
9084,"198510, Санкт-Петербург (г.), Санкт-Петербург, Ольгина, д.2",124408,"г.Санкт-Петербург, Средний проспект В.О., дом 85, литера У"
2501,"195276, Санкт-Петербург (г.), Демьяна Бедного (ул.), д.22, Строение 4",218432,"г.Санкт-Петербург, Боровая улица, дом 53, корпус 4, строение 1"
12531,"191119, Санкт-Петербург г, Марата ул, д.68",196474,"г.Санкт-Петербург, улица Салова, дом 68, литера Г1"
8497,"192174, Санкт-Петербург г, Ново-Александровская ул, д.28",1243,"г.Санкт-Петербург, Прилукская улица, дом 28"
3034,"195427, Санкт-Петербург (г.), Академика Байкова (ул.), д.9, Строение 2",216675,"г.Санкт-Петербург, Благодатная улица, дом 69, корпус 1, строение 4"
9793,"197341, Санкт-Петербург г, Поликарпова аллея, д.3, Строение 2",60370,"г.Санкт-Петербург, Торики, садоводство ""АТП-71"", Дубовая улица, дом 3"
1008,"194017, Санкт-Петербург (г.), Санкт-Петербург г, Гданьская ул, д.3 А",24058,"г.Санкт-Петербург, Косая линия, дом 16, корпус 40, литера Г26"
11440,"196602, Санкт-Петербург г, Пушкин г, Гусарская ул, д.4, Строение 11",216675,"г.Санкт-Петербург, Благодатная улица, дом 69, корпус 1, строение 4"
976,"194223, Санкт-Петербург (г.), Санкт-Петербург г, Орбели ул, д.8 А",39468,"г.Санкт-Петербург, Индустриальный проспект, дом 67, литера Г2"
5662,"198205, Санкт-Петербург г, Авангардная ул, д.53, Строение 2",224346,"г.Санкт-Петербург, улица Салова, дом 53, корпус 3, строение 2"
8463,"193079, Санкт-Петербург г, Народная ул, д.7",101197,"г.Санкт-Петербург, 7-я Советская улица, дом 30, литера А"
2786,"195297, Санкт-Петербург (г.), Светлановский (пр-кт.), д.109, Строение 4",212240,"г.Санкт-Петербург, проспект Славы, дом 52, корпус 4, строение 1"
11555,"192212, Санкт-Петербург г, Славы пр-кт, д.6, Строение 1",83804,"г.Санкт-Петербург, 12-я Красноармейская улица, дом 24, литера Д"
1988,"195220, Санкт-Петербург (г.), Гражданский (пр-кт.), д.15, Строение 5",135310,"г.Санкт-Петербург, Володарский, улица Свердлова, дом 20/2, литера Г5"
12243,"192238, Санкт-Петербург г, Белы Куна ул, д.9, Строение 2",62779,"г.Санкт-Петербург, Бестужевская улица, дом 23, строение 1"
7106,"196247, Санкт-Петербург г, Краснопутиловская ул, д.87",104977,"г.Санкт-Петербург, Кубинская улица, дом 87, литера Б"
11059,"196602, Санкт-Петербург (г.), Санкт-Петербург г, Пушкин г, Павловское ш, д.39",14083,"г.Санкт-Петербург, проспект Большевиков, дом 39, корпус 1, литера Б"
8721,"193079, Санкт-Петербург г, Октябрьская наб, д.84, Строение 2",19314,"г.Санкт-Петербург, Октябрьская набережная, дом 84, корпус 1, литера Т"
31,"190020, Санкт-Петербург (г.), Санкт-Петербург г, Нарвский проспект, д.25, лит. А",103259,"г.Санкт-Петербург, Пискарёвский проспект, дом 25, литера Е"
11774,"192283, Санкт-Петербург г, Будапештская ул, д.101, Строение 2",220091,"г.Санкт-Петербург, Челябинская улица, дом 101, корпус 3, строение 1"
2731,"195256, Санкт-Петербург (г.), Софьи Ковалевской (ул.), д.16, Строение 2",43315,"г.Санкт-Петербург, Комендантский проспект, дом 16, корпус 2, литера Б"
4465,"195426, Санкт-Петербург г, Хасанская ул, д.4, Строение 2",109695,"г.Санкт-Петербург, 4-я Советская улица, дом 26, литера А"
7472,"196158, Санкт-Петербург (г.), Идрицкая, д.5, корп.3",30552,"г.Санкт-Петербург, Двинская улица, дом 5/7"
7398,"196066, Санкт-Петербург г, Алтайская ул, д.19",11937,"г.Санкт-Петербург, Английский проспект, дом 21/60, литера Б"
3300,"198215, Санкт-Петербург г, Новаторов б-р, д.74",21085,"г.Санкт-Петербург, Средний проспект В.О., дом 74"
2764,"195265, Санкт-Петербург (г.), Луначарского (пр-кт.), д.110, Строение А",34630,"г.Санкт-Петербург, Гражданский проспект, дом 110, корпус 3, литера А"
9876,"197374, Санкт-Петербург г, Школьная ул, д.74",89248,"г.Санкт-Петербург, Планерная улица, дом 73, корпус 4"
7349,"196191, Санкт-Петербург г, Новоизмайловский пр-кт, д.22, Строение 3А",210836,"г.Санкт-Петербург, Комендантский проспект, дом 61, строение 1"
11244,"196634, Санкт-Петербург г, Колпинское (Славянка) ш, д.12, Строение 3",219326,"г.Санкт-Петербург, Студенческая улица, дом 24, корпус 3, строение 1"
2513,"195269, Санкт-Петербург (г.), Светлановский (пр-кт.), д.62, Строение 4",100747,"г.Санкт-Петербург, Светлановский проспект, дом 62, корпус 3, литера А"
6383,"198320, Санкт-Петербург г, Лермонтова ул, д.23",31414,"г.Санкт-Петербург, улица Салова, дом 23, литера Г4"
11210,"196626, Санкт-Петербург г, Первомайская ул, д.7",95660,"г.Санкт-Петербург, 7-я Советская улица, дом 26, литера А"
5106,"195030, Санкт-Петербург г, Коммуны ул, д.42, Строение 2",206774,"г.Санкт-Петербург, Лахта, Новая улица, дом 51, корпус 42"
3724,"198261, Санкт-Петербург г, Ветеранов пр-кт, д.112, Строение 3",211730,"г.Санкт-Петербург, 3-й Верхний переулок, дом 11, строение 2"
9126,"198510, Санкт-Петербург г, Петергоф г, Никольская ул, д.5",221313,"г.Санкт-Петербург, проспект Космонавтов, дом 85, строение 5"
10615,"197373, Санкт-Петербург (г.), Комендантский пр, д.53, 3,А,",45982,"г.Санкт-Петербург, Комендантский проспект, дом 53, корпус 4, литера А"
2591,"195299, Санкт-Петербург (г.), Черкасова (ул.), д.23, Строение А",31090,"г.Санкт-Петербург, улица Руднева, дом 21, корпус 4, литера А"
7656,"192029, Санкт-Петербург (г.), Обуховской Обороны (пр-кт.), д.70 4",220842,"г.Санкт-Петербург, проспект Обуховской Обороны, дом 70, корпус 4, строение 1"
12734,"191186, Санкт-Петербург г, Невский пр-кт, д.5",216182,"г.Санкт-Петербург, Вилькицкий бульвар, дом 5, строение 1"
3952,"196655, Санкт-Петербург, Правды ул, д.9",63034,"г.Санкт-Петербург, Лахтинский проспект, дом 67"
675,"199155, Санкт-Петербург (г.), Санкт-Петербург г, КИМа пр-кт, д.9",198779,"г.Санкт-Петербург, 9-я линия В.О., дом 64/25, литера А"
12178,"192236, Санкт-Петербург г, Славы пр-кт, д.62",211877,"г.Санкт-Петербург, Кирочная улица, дом 62, строение 1"
6886,"Санкт-Петербург (г.), Дунайский (пр-кт.), д.29, Строение 4",211815,"г.Санкт-Петербург, Дунайский проспект, дом 29, корпус 4, строение 1"
9601,"197372, Санкт-Петербург г, Стародеревенская ул, д.23, Строение 3",213178,"г.Санкт-Петербург, Стародеревенская улица, дом 23, корпус 3, строение 1"
10396,"197372, Санкт-Петербург (г.), Оптиков ул., д.49, 3, А",206751,"г.Санкт-Петербург, Лахта, Новая улица, дом 51, корпус 73"
12146,"192071, Санкт-Петербург г, Бухарестская ул, д.33, Строение 4",52315,"г.Санкт-Петербург, Смоленская улица, дом 33, литера Б"
3236,"198096, Санкт-Петербург г, Стачек пр-кт, д.82, Строение 2",60335,"г.Санкт-Петербург, Средний проспект В.О., дом 82, литера В"
9526,"197374, Санкт-Петербург (г.), Приморский (пр-кт.), д.52, Строение 1",212240,"г.Санкт-Петербург, проспект Славы, дом 52, корпус 4, строение 1"
1553,"194352, Санкт-Петербург (г.), Санкт-Петербург г, Придорожная аллея, д.9-2",128331,"г.Санкт-Петербург, Торики, садоводство ""Дружный-2"", Южная аллея, участок 41"
1648,"194358, Санкт-Петербург (г.), Санкт-Петербург г, Есенина ул, д.40-4 А",223540,"г.Санкт-Петербург, Промышленная улица, дом 40, строение 4"
6947,"196128, Санкт-Петербург г, Новоизмайловский пр-кт, д.12",11126,"г.Санкт-Петербург, Новосибирская улица, дом 12"
12201,"192241, Санкт-Петербург г, Турку ул, д.22, Строение 6",215141,"г.Санкт-Петербург, Елисеевская улица, дом 22, строение 1"
8948,"197198, Санкт-Петербург (г.), Ждановская (наб.), д.11, Строение Д",189528,"г.Санкт-Петербург, Торики, садоводство ""АТП-71"", дом 11, литера А"
266,"190031, Санкт-Петербург г, Гражданская ул, д.21",22186,"г.Санкт-Петербург, Греческий проспект, дом 21, литера Г"
9169,"198516, Санкт-Петербург г, Петергоф г, Жарновецкого ул, д.10",29741,"г.Санкт-Петербург, 10-я Красноармейская улица, дом 22, литера Ж"
12319,"192241, Санкт-Петербург г, Софийская ул, д.35, Строение 7",212235,"г.Санкт-Петербург, Елисеевская улица, дом 35, строение 1"
1080,"194355, Санкт-Петербург (г.), Просвещения (пр-кт.), д.7, Строение 2",211741,"г.Санкт-Петербург, Бестужевская улица, дом 7, корпус 4, строение 1"
11740,"192239, Санкт-Петербург г, Альпийский пер, д.5, Строение 1",134593,"г.Санкт-Петербург, Володарский, Пензенский переулок, дом 5, литера Г1"
2383,"195273, Санкт-Петербург (г.), Верности (ул.), д.44, Строение 2",135355,"г.Санкт-Петербург, Северный проспект, дом 44, корпус 3, литера Г2"
513,"199178, Санкт-Петербург г, 14-я В.О. линия, д.65",9032,"г.Санкт-Петербург, 14-я линия В.О., дом 65, литера А"
6635,"197706, Санкт-Петербург г, Сестрорецк г, Володарского ул, д.44",135356,"г.Санкт-Петербург, Северный проспект, дом 44, корпус 3, литера Г7"
7438,"196084, Санкт-Петербург (г.), Санкт-Петербург г, Киевская, д.3",218152,"г.Санкт-Петербург, Комендантский проспект, дом 60, корпус 3, строение 1"
5013,"195196, Санкт-Петербург г, Стахановцев ул, д.10, Строение 2",206559,"г.Санкт-Петербург, Новая улица, дом 51, корпус 10, строение 1"
8912,"197136, Санкт-Петербург (г.), Санкт-Петербург г, Ленина ул, д.34 А",29175,"г.Санкт-Петербург, улица Лёни Голикова, дом 72, литера А"
3601,"198097, Санкт-Петербург г, Огородный пер, д.11",212881,"г.Санкт-Петербург, Малоохтинский проспект, дом 80/2, строение 11"
5161,"195030, Санкт-Петербург г, Наставников пр-кт, д.29, Строение 2",31915,"г.Санкт-Петербург, Садовая улица, дом 28-30, корпус 51"
6752,"196247, Санкт-Петербург (г.), Санкт-Петербург г, Новоизмайловский пр-кт, д.83А",128014,"г.Санкт-Петербург, проспект Непокорённых, дом 63, корпус 12, литера Б"
8260,"192148, Санкт-Петербург г, Ольминского ул, д.29",99875,"г.Санкт-Петербург, Коломенская улица, дом 29"
12547,"191186, Санкт-Петербург г, Гороховая ул, д.8/13",69892,"г.Санкт-Петербург, Гороховая улица, дом 8/13, литера А"
12363,"192242, Санкт-Петербург г, Будапештская ул, д.12, Строение 2",221470,"г.Санкт-Петербург, Белоостровская улица, дом 12, строение 1"
5249,"195279, Санкт-Петербург г, Ударников пр-кт, д.30, Строение 3",20533,"г.Санкт-Петербург, проспект Художников, дом 30, корпус 3"
5272,"195426, Санкт-Петербург г, Косыгина пр-кт, д.9, Строение 3",80544,"г.Санкт-Петербург, 3-я Конная Лахта, дом 23, литера Б"
8902,"197101, Санкт-Петербург (г.), Рентгена (ул.), д.15/31, Строение А",101558,"г.Санкт-Петербург, улица Седова, дом 71, корпус 3, строение 1"
11532,"196621, Санкт-Петербург (г.), Павловск (г.), Садовая (ул.), д.51, Строение А",206464,"г.Санкт-Петербург, Новая улица, дом 51, корпус 66, строение 1"
12568,"191002, Санкт-Петербург г, Рубинштейна ул, д.21",102870,"г.Санкт-Петербург, Глиняная улица, дом 21"
7951,"192076, Санкт-Петербург г, Рыбацкий пр-кт, д.51, Строение 2",206431,"г.Санкт-Петербург, Новая улица, дом 51, корпус 20, строение 1"
11815,"192289, Санкт-Петербург г, Малая Карпатская ул, д.9, Строение 2",213305,"г.Санкт-Петербург, улица Маршала Казакова, дом 23, корпус 2, строение 9"
11114,"196601, Санкт-Петербург г, Пушкин г, Малая ул, д.21",38624,"г.Санкт-Петербург, 1-я Красноармейская улица, дом 1/21, литера М"
7318,"196158, Санкт-Петербург г, Ленсовета ул, д.79",52941,"г.Санкт-Петербург, Народная улица, дом 79, литера С"
11874,"192288, Санкт-Петербург г, Димитрова ул, д.29, Строение 3",211737,"г.Санкт-Петербург, улица Руставели, дом 29, строение 3"
2819,"195271, Санкт-Петербург (г.), Замшина (ул.), д.52, Строение 1",36988,"г.Санкт-Петербург, Рядовая улица, дом 52, строение 1"
10973,"196602, Санкт-Петербург (г.), Пушкин г., Красной Звезды, д.10 а",13905,"г.Санкт-Петербург, проспект Стачек, дом 67, корпус 10, литера А"
5674,"198259, Санкт-Петербург г, Здоровцева ул, д.27, Строение 3",224363,"г.Санкт-Петербург, Новоорловская улица, дом 1, строение 3"
8536,"192012, Санкт-Петербург г, 2-й Рабфаковский пер, д.12",24463,"г.Санкт-Петербург, Шафировский проспект, дом 12"
6173,"198328, Санкт-Петербург г, Ленинский пр-кт, д.53, Строение 2",139733,"г.Санкт-Петербург, Ленинский проспект, дом 53, корпус 3, литера А"
9436,"197343, Санкт-Петербург (г.), Омская (ул.), д.20, Строение А",101558,"г.Санкт-Петербург, улица Седова, дом 71, корпус 3, строение 1"
190,"190020, Санкт-Петербург г, Курляндская ул, д.26",41774,"г.Санкт-Петербург, Боткинская улица, дом 25, литера Е"
10031,"197082, Санкт-Петербург (г.), Санкт-Петербург г, Туристская ул, д.20, 3, А",25554,"г.Санкт-Петербург, Кубинская улица, дом 70, корпус 3, литера А"
6128,"198320, Санкт-Петербург г, Красное Село г, Гатчинское ш, д.6, Строение 3",223730,"город Павловск, тер. СНТ ""Славяночка-3"", Дружная улица, дом 6, строение 1"
105,"198035, Санкт-Петербург г, Рижский пр-кт, д.72-74",31553,"г.Санкт-Петербург, Рижский проспект, дом 72"
5410,"198205, Санкт-Петербург г, Ветеранов пр-кт, д.126",132070,"г.Санкт-Петербург, Витебский проспект, дом 12, литера Г3"
2984,"195297, Санкт-Петербург (г.), Тимуровская (ул.), д.12, Строение 2",8141,"г.Санкт-Петербург, Кузнецовская улица, дом 52, корпус 12"
10183,"197350, Санкт-Петербург (г.), Королёва пр., д.57, 2, 1",206751,"г.Санкт-Петербург, Лахта, Новая улица, дом 51, корпус 73"
2097,"195221, Санкт-Петербург (г.), Антоновская (ул.), д.14, Строение 1",31600,"г.Санкт-Петербург, Английский проспект, дом 13, литера Б"
1387,"194100, Санкт-Петербург (г.), Санкт-Петербург г, Харченко ул, д.15",62789,"г.Санкт-Петербург, 1-я Жерновская улица, дом 41"
88,"190005, Санкт-Петербург (г.), Санкт-Петербург г, Измайловский пр-кт, д.18",132147,"г.Санкт-Петербург, Володарский, улица Володарского, дом 25/19, литера Г"
7001,"196070, Санкт-Петербург (г.), Санкт-Петербург г, Фрунзе, д.1",212879,"г.Санкт-Петербург, набережная Макарова, дом 60, строение 1"
11661,"192281, Санкт-Петербург г, Дунайский пр-кт, д.33, Строение 3",97818,"г.Санкт-Петербург, Заставская улица, дом 33, строение 3"
3382,"198260, Санкт-Петербург г, Солдата Корзуна ул, д.5, Строение 2",135611,"г.Санкт-Петербург, Горелово, Социалистическая улица, дом 81, литера Г5"
11152,"196626, Санкт-Петербург г, Пушкинская ул, д.42",23574,"г.Санкт-Петербург, Большая Морская улица, дом 42"
4114,"196653, Санкт-Петербург г, Колпино г, ул. Адмиралтейская, д.23",210821,"г.Санкт-Петербург, Комендантский проспект, дом 67, строение 1"
4139,"196653, Санкт-Петербург г, Колпино г, Пролетарская ул, д.111",63034,"г.Санкт-Петербург, Лахтинский проспект, дом 67"
12827,"191167, Санкт-Петербург г, Конная ул, д.32",64690,"г.Санкт-Петербург, Коломенская улица, дом 32"
8600,"193315, Санкт-Петербург г, Новоселов ул, д.53",90786,"г.Санкт-Петербург, Вознесенский проспект, дом 53"
5185,"195426, Санкт-Петербург г, Ленская ул, д.11, Строение 3",109695,"г.Санкт-Петербург, 4-я Советская улица, дом 26, литера А"
