id,address,target_building_id_test,target_address,target_building_id,weighted_similarity
276,"Генерала Симоняка, д.8",10023,"г.Санкт-Петербург, улица Генерала Симоняка, дом 9",75942,0
275,"Бухарестская, д.57",26072,"г.Санкт-Петербург, Бухарестская улица, дом 57, литера А",26072,0
274,"Среднегаванский пр, д.12",198823,"г.Санкт-Петербург, Среднегаванский проспект, дом 12",10728,0
273,"4 линия, д.61",14203,"г.Санкт-Петербург, 8-я линия В.О., дом 61, литера А",78751,0
272,"Галерная, д.47",39240,"г.Санкт-Петербург, Галерная улица, дом 47, литера А",39240,0
271,"Средний, д.35 Б",71882,"г.Санкт-Петербург, Средний проспект В.О., дом 35, литера Б",71882,0
270,"Кирочная , д.46",105794,"г.Санкт-Петербург, Кирочная улица, дом 46, литера А",105794,0
165,"Дундича Олеко, д.5",69501,"г.Санкт-Петербург, улица Олеко Дундича, дом 5, литера А",69501,0
164,"Литейный, д.31",93523,"г.Санкт-Петербург, Литейный проспект, дом 31, литера В",34889,0
163,"Саперный пер. , д.12",55291,"г.Санкт-Петербург, Саперный переулок, дом 9",48218,0
41,"197229, Санкт-Петербург г, Хвойная ул, д.35",46676,"г.Санкт-Петербург, Хвойная улица, дом 35, литера В",14234,0
59,"192212, Санкт-Петербург г, Славы пр-кт, д.14",61243,"г.Санкт-Петербург, Стартовая улица, дом 17, литера КТ",188144,0
58,"192286, Санкт-Петербург г, Славы пр-кт, д.23, Строение 2",21721,"г.Санкт-Петербург, Стартовая улица, дом 17, литера КТ",188144,0
57,"192283, Санкт-Петербург г, Загребский б-р, д.35, Строение 2",101113,"г.Санкт-Петербург, Загребский бульвар, дом 35, корпус 3, строение 1",217303,0
56,"192288, Санкт-Петербург г, Ярослава Гашека ул, д.30, Строение 2",40842,"г.Санкт-Петербург, улица Ярослава Гашека, дом 30/5, литера А",88474,0
55,"192283, Санкт-Петербург г, Купчинская ул, д.29, Строение 2",32967,"г.Санкт-Петербург, Купчинская улица, дом 29, корпус 2, литера А",32967,0
54,"192238, Санкт-Петербург г, Бухарестская ул, д.68, Строение 3",57000,"г.Санкт-Петербург, Бухарестская улица, дом 68, корпус 2",50987,0
53,"196657, Санкт-Петербург г, Волховская (Новая Ижора) ул, д.3",139532,"посёлок Шушары, Новая Ижора, Волховская улица, дом 3, литера А",139532,0
52,"196601, Санкт-Петербург г, Пушкин г, Пушкинская ул, д.49",92502,"город Пушкин, Пушкинская улица, дом 49, литера А",92502,0
51,"196632, Санкт-Петербург г, Пушкин г, Лесное п, д.12",138162,"город Пушкин, Лесное, дом 12, литера А",21660,0
50,"196626, Санкт-Петербург г, Вишерская ул, д.3, Строение 1",212840,"посёлок Шушары, Вишерская улица, дом 2, строение 1",213980,0
49,"196625, Санкт-Петербург г, Тярлевская ул, д.12",40818,"посёлок Тярлево, Тярлевская улица, дом 12, литера А",40818,0
48,"196605, Санкт-Петербург г, Пушкин г, Детскосельский б-р, д.3",70868,"город Пушкин, Детскосельский бульвар, дом 8, литера А",6810,0
47,"196608, Санкт-Петербург г, Пушкин г, Ахматовская ул, д.13",102374,"город Пушкин, Ахматовская улица, дом 13, литера А",102374,0
46,"196601, Санкт-Петербург г, Пушкин г, Новодеревенская ул, д.1",17305,"город Пушкин, Новодеревенская улица, дом 5, литера А",10559,0
45,"196603, Санкт-Петербург (г.), Пушкин (г.), Красносельское (ш.), д.57, Строение А",68196,"город Пушкин, Красносельское шоссе, дом 57, литера А",68196,0
44,"197082, Санкт-Петербург (г.), Туристская (ул.), д.28, Строение 2",221296,"г.Санкт-Петербург, Туристская улица, дом 28, корпус 2, строение 1",221296,0
43,"197374, Санкт-Петербург г, Школьная ул, д.110, Строение 2",69594,"г.Санкт-Петербург, Школьная улица, дом 110, корпус 1, литера А",15042,0
60,"192239, Санкт-Петербург г, Славы пр-кт, д.19, Строение 2",12481,"г.Санкт-Петербург, Стартовая улица, дом 17, литера КТ",188144,0
61,"192102, Санкт-Петербург г, Стрельбищенская ул, д.8",34432,"г.Санкт-Петербург, Стрельбищенская улица",200126,0
62,"192286, Санкт-Петербург г, Бухарестская ул, д.51",105317,"г.Санкт-Петербург, Бухарестская улица, дом 51, литера А",105317,0
72,"191167, Санкт-Петербург г, Невский пр-кт, д.182",80415,"г.Санкт-Петербург, Невский проспект, дом 182, литера А",80415,0
79,"191025, Санкт-Петербург г, Маяковского ул, д.1/96",75734,"г.Санкт-Петербург, улица Маяковского, дом 1/96, литера А",75734,0
78,"191025, Санкт-Петербург г, Марата ул, д.16",61145,"г.Санкт-Петербург, улица Марата, дом 16, литера Б",1695,0
77,"191124, Санкт-Петербург (г.), Санкт-Петербург, Тульская, д.9",123821,"г.Санкт-Петербург, Тульская улица, дом 3",188300,0
76,"191124, Санкт-Петербург г, Новгородская ул, д.25",29085,"г.Санкт-Петербург, Новгородская улица, дом 25, литера А",29085,0
75,"191015, Санкт-Петербург г, Очаковская ул, д.2, Строение А",39972,"г.Санкт-Петербург, Очаковская улица, дом 3",41736,0
74,"191015, Санкт-Петербург г, Таврическая ул, д.2, Строение г",639,"г.Санкт-Петербург, Таврическая улица, дом 2, литера Г",639,0
73,"191186, Санкт-Петербург г, Миллионная ул, д.23",66545,"г.Санкт-Петербург, Миллионная улица, дом 23, литера А",66545,0
71,"191167, Санкт-Петербург г, Александра Невского ул, д.7",111908,"г.Санкт-Петербург, улица Александра Невского, дом 3, литера А",9551,0
63,"192102, Санкт-Петербург (г.), Санкт-Петербург г, Волковский пр-кт, д.20",67299,"г.Санкт-Петербург, Волковский проспект, дом 20, корпус 2, литера А",56521,0
70,"191024, Санкт-Петербург г, Конная ул, д.9",70877,"г.Санкт-Петербург, Конная улица, дом 5/3, литера В",140021,0
69,"192283, Санкт-Петербург г, Будапештская ул, д.93",8857,"г.Санкт-Петербург, Будапештская улица, дом 93, литера А",8857,0
68,"192212, Санкт-Петербург г, Славы пр-кт, д.6, Строение 2, литер А",106388,"г.Санкт-Петербург, Стартовая улица, дом 17, литера КТ",188144,0
67,"192284, Санкт-Петербург г, Купчинская ул, д.11, Строение 3",83217,"г.Санкт-Петербург, Купчинская улица, дом 11, корпус 4, литера А",26004,0
66,"192238, Санкт-Петербург (г.), Южное (ш.), д.49, Строение 4",216248,"г.Санкт-Петербург, Южное шоссе, дом 49, корпус 3, строение 1",210045,0
65,"192242, Санкт-Петербург г, Турку ул, д.2, Строение 2",45873,"г.Санкт-Петербург, улица Турку",200776,0
64,"192212, Санкт-Петербург г, Будапештская ул, д.23, Строение 3",84899,"г.Санкт-Петербург, Будапештская улица, дом 23, корпус 4, литера Б",171,0
42,"197373, Санкт-Петербург (г.), Санкт-Петербург г, Авиаконструкторов пр-кт, д.23/2",12175,"г.Санкт-Петербург, проспект Авиаконструкторов, дом 23, корпус 2, литера А",12175,0
40,"197755, Санкт-Петербург г, Новоцентральная ул, д.21/7",86963,"посёлок Лисий Нос, Новоцентральная улица, дом 21/7, литера Д",75752,0
81,"191024, Санкт-Петербург г, Советская 2-я ул, д.27/2",16249,"г.Санкт-Петербург, 7-я Советская улица, дом 27",105453,0
39,"197375, Санкт-Петербург г, Репищева ул, д.17, Строение 2",5345,"г.Санкт-Петербург, Репищева улица, дом 17",5311,0
18,"197372, Санкт-Петербург (г.), Яхтенная (ул.), д.28, Строение 1",214838,"г.Санкт-Петербург, Яхтенная улица, дом 28, строение 1",214838,0
17,"197350, Санкт-Петербург (г.), Парашютная (ул.), д.36, Строение 2",215214,"г.Санкт-Петербург, Парашютная улица, дом 36, корпус 1, строение 1",213151,0
16,"197342, Санкт-Петербург (г.), Торжковская (ул.), д.9, Строение 2",95617,"г.Санкт-Петербург, Торжковская улица",200117,0
15,"198504, Санкт-Петербург г, Петергоф г, Ботаническая ул, д.6",58708,"город Петергоф, Ботаническая улица",202615,0
14,"198412, Санкт-Петербург г, Ломоносов г, Красноармейская ул, д.3",13414,"город Ломоносов, Красноармейская улица, дом 5, литера А",8488,0
13,"198412, Санкт-Петербург г, Ломоносов г, Михайловская ул, д.24/22, Строение 22",32105,"город Ломоносов, Михайловская улица, дом 24/22, литера А",32105,0
12,"198510, Санкт-Петербург г, Петергоф г, Суворовский городок, д.17",11847,"город Петергоф, Суворовский городок, дом 17, литера А",11847,0
11,"198504, Санкт-Петербург г, Петергоф г, Шахматова ул, д.16, Строение 1",62303,"город Петергоф, улица Шахматова, дом 16, литера А",42103,0
10,"197022, Санкт-Петербург г, Профессора Попова ул, д.31",53597,"г.Санкт-Петербург, улица Профессора Попова, дом 1",81797,0
9,"197101, Санкт-Петербург г, Пушкарская М. ул, д.20/4",198891,"г.Санкт-Петербург, Большая Пушкарская улица, дом 20, литера А",32144,0
8,"197110, Санкт-Петербург г, Разночинная Б. ул, д.25",37859,"г.Санкт-Петербург, Большая Разночинная улица, дом 25, литера А",37859,0
7,"197022, Санкт-Петербург (г.), Аптекарский (пр-кт.), д.18, Строение А",209676,"г.Санкт-Петербург, Аптекарский проспект, дом 18, литера А",209676,0
6,"197110, Санкт-Петербург г, Петровский остров, д.10",89946,"г.Санкт-Петербург, Петровский остров, дом 2, литера Д",42955,0
5,"197101, Санкт-Петербург (г.), Санкт-Петербург г, Монетная Б. ул, д.8",29732,"г.Санкт-Петербург, Большая Монетная улица, дом 9, литера А",3494,0
4,"197022, Санкт-Петербург (г.), Санкт-Петербург г, Ординарная ул, д.20",13759,"г.Санкт-Петербург, Ординарная улица, дом 20, литера А",13759,0
3,"197022, Санкт-Петербург (г.), Санкт-Петербург г, Ординарная ул, д.19",53075,"г.Санкт-Петербург, Ординарная улица, дом 19, литера А",53075,0
2,"197136, Санкт-Петербург г, Ленина ул, д.20",66919,"г.Санкт-Петербург, улица Ленина, дом 20, литера Д",44425,0
19,"197348, Санкт-Петербург (г.), Коломяжский (пр-кт.), д.15, Строение 2",106374,"г.Санкт-Петербург, Стартовая улица, дом 17, литера КТ",188144,0
20,"197343, Санкт-Петербург г, Омская ул, д.18",72972,"г.Санкт-Петербург, Омская улица, дом 18, литера А",72972,0
21,"197373, Санкт-Петербург (г.), Санкт-Петербург г, Комендантский пр., д.60, 2",218507,"г.Санкт-Петербург, Комендантский проспект, дом 60, корпус 1, строение 1",212234,0
31,"197350, Санкт-Петербург г, Комендантский пр-кт, д.35, Строение 4",16049,"г.Санкт-Петербург, Стартовая улица, дом 17, литера КТ",188144,0
38,"197372, Санкт-Петербург г, Богатырский пр-кт, д.36, Строение 2",40637,"г.Санкт-Петербург, Стартовая улица, дом 17, литера КТ",188144,0
37,"197372, Санкт-Петербург г, Камышовая ул, д.22, Строение 2",41063,"г.Санкт-Петербург, Камышовая улица, дом 22, корпус 2, литера А",41063,0
36,"197371, Санкт-Петербург г, Шаврова ул, д.25, Строение 2",105676,"г.Санкт-Петербург, улица Шаврова, дом 25, корпус 1, литера А",94194,0
35,"197373, Санкт-Петербург г, Планерная ул, д.55, Строение 2",79187,"г.Санкт-Петербург, Планерная улица, дом 55, корпус 1",68440,0
34,"197374, Санкт-Петербург (г.), Санкт-Петербург г, Савушкина ул, д.128, 2,А",28929,"г.Санкт-Петербург, улица Савушкина, дом 128, корпус 1, литера А",18370,0
33,"197348, Санкт-Петербург г, Богатырский пр-кт, д.5, Строение 4",57117,"г.Санкт-Петербург, Стартовая улица, дом 17, литера КТ",188144,0
32,"197373, Санкт-Петербург (г.), Авиаконструкторов (пр-кт.), д.31, 2, А",106196,"г.Санкт-Петербург, проспект Авиаконструкторов, дом 31",15649,0
30,"197374, Санкт-Петербург (г.), Оптиков ул., д.31, 2, А",128544,"г.Санкт-Петербург, улица Оптиков, дом 31, корпус 2, литера А",128544,0
22,"197341, Санкт-Петербург г, Королева пр-кт, д.17",46390,"г.Санкт-Петербург, Стартовая улица, дом 17, литера КТ",188144,0
29,"197372, Санкт-Петербург г, Богатырский пр-кт, д.50, Строение 3",127950,"г.Санкт-Петербург, Богатырский проспект, дом 50, корпус 1, литера Б",4074,0
28,"197227, Санкт-Петербург г, Гаккелевская ул, д.33, Строение 2",78253,"г.Санкт-Петербург, Гаккелевская улица, дом 33, корпус 1, литера А",63489,0
27,"197343, Санкт-Петербург г, Омская ул, д.25",8449,"г.Санкт-Петербург, Омская улица, дом 25, литера А",8449,0
26,"197371, Санкт-Петербург г, Королева пр-кт, д.42, Строение 2",15929,"г.Санкт-Петербург, проспект Королева, дом 42, корпус 3",48025,0
25,"190000, Санкт-Петербург (г.), Верхне-Каменская (ул.), д.7",219281,"муниципальный округ Коломяги, Верхне-Каменская улица, дом 5, строение 1",219280,0
24,"197375, Санкт-Петербург г, Новоколомяжский пр-кт, д.3",64915,"г.Санкт-Петербург, Новоколомяжский проспект, дом 9, литера А",46492,0
23,"197183, Санкт-Петербург г, Дибуновская ул, д.10",68341,"г.Санкт-Петербург, Дибуновская улица, дом 10, литера А",68341,0
80,"191002, Санкт-Петербург г, Ломоносова ул, д.18",62979,"г.Санкт-Петербург, улица Ломоносова, дом 18, литера Т",51651,0
82,"191014, Санкт-Петербург, Маяковского ул, д.9/16",87568,"г.Санкт-Петербург, улица Маяковского, дом 9/16, литера Б",10898,0
162,"Металлистов, д.128",85239,"г.Санкт-Петербург, проспект Металлистов, дом 128, литера А",85239,0
123,"Краснопутиловская, д.13/10",28072,"г.Санкт-Петербург, Краснопутиловская улица, дом 13, литера А",28072,0
141,"Таврическая, д.29",6717,"г.Санкт-Петербург, Таврическая улица, дом 29, литера А",6717,0
140,"Блюхера Маршала, д.67",38559,"г.Санкт-Петербург, проспект Маршала Блюхера, дом 67, корпус 1, литера А",38559,0
139,"Лени Голикова, д.90",24851,"г.Санкт-Петербург, улица Лёни Голикова, дом 90, литера А",24851,0
138,"Гашека Ярослава, д.24",30630,"г.Санкт-Петербург, улица Ярослава Гашека, дом 24, корпус 1, литера А",30630,0
137,"Стойкости, д.5",26586,"г.Санкт-Петербург, улица Стойкости, дом 9, литера А",1035,0
136,"Суворовский , д.42",55135,"г.Санкт-Петербург, Суворовский проспект, дом 42, литера Б",48800,0
135,"Октябрьская наб., д.92",16013,"г.Санкт-Петербург, Октябрьская набережная, дом 92, корпус 2, литера Е",134480,0
134,"Малодетскосельский, д.27",18946,"г.Санкт-Петербург, Малодетскосельский проспект, дом 27, литера А",18946,0
133,"Краснопутиловская, д.30",91345,"г.Санкт-Петербург, Краснопутиловская улица, дом 30, литера В",88344,0
132,"Космонавтов, д.76",20452,"г.Санкт-Петербург, проспект Космонавтов, дом 76, литера А",20452,0
131,"Таврическая, д.37",197825,"г.Санкт-Петербург, Таврическая улица, дом 37",26171,0
130,"Орджоникидзе, д.59",80625,"г.Санкт-Петербург, улица Орджоникидзе, дом 59, литера А",80625,0
129,"4 Советская , д.27",57240,"г.Санкт-Петербург, 7-я Советская улица, дом 27",105453,0
128,"Малый пр В.О., д.3",32101,"г.Санкт-Петербург, Малый проспект П.С., дом 4",88125,0
127,"Московский , д.36",21777,"г.Санкт-Петербург, Московский проспект, дом 36, литера А",21777,0
126,"Шкапина, д.22",71540,"г.Санкт-Петербург, улица Шкапина, дом 22, литера А",71540,0
125,"Большой пр В.О., д.35 А",83173,"г.Санкт-Петербург, Большой проспект П.С., дом 35, литера А",81284,0
142,"наб. реки Мойки, д.85",31596,"г.Санкт-Петербург, набережная реки Мойки, дом 7, литера А",8784,0
143,"Гладкова, д.39",30703,"г.Санкт-Петербург, улица Гладкова, дом 39, литера В",30703,0
144,"Полюстровский, д.35",114144,"г.Санкт-Петербург, Полюстровский проспект, дом 35, литера А",114144,0
154,"Столярный пер, д.9",53201,"г.Санкт-Петербург, Столярный переулок, дом 6, литера А",26370,0
161,"Брюсовская, д.2",90705,"г.Санкт-Петербург, Брюсовская улица",200132,0
160,"Римского-Корсакова, д.15",112601,"г.Санкт-Петербург, проспект Римского-Корсакова, дом 15, литера А",112601,0
159,"2 Красноармейская, д.2",108110,"г.Санкт-Петербург, 2-я Красноармейская улица, дом 3",44939,0
158,"Рыбацкий, д.18",74051,"г.Санкт-Петербург, Рыбацкий проспект, дом 18, литера Д",12185,0
157,"Полюстровский, д.33",10894,"г.Санкт-Петербург, Полюстровский проспект, дом 33, корпус 1, литера А",10894,0
156,"1 Красноармейская, д.6",13152,"г.Санкт-Петербург, 2-я Красноармейская улица, дом 3",44939,0
155,"Лиговский , д.233",29985,"г.Санкт-Петербург, Лиговский проспект, дом 233, литера А",29985,0
153,"Моховая, д.36",75977,"г.Санкт-Петербург, Моховая улица, дом 36, литера Б",1925,0
145,"Купчинская, д.3",92540,"г.Санкт-Петербург, Купчинская улица",202330,0
152,"Херсонская, д.21",196901,"г.Санкт-Петербург, Херсонская улица, дом 21",72714,0
151," пр Стачек , д.188",19974,"г.Санкт-Петербург, проспект Стачек, дом 188, литера А",19974,0
150,"Большевиков, д.63",81062,"г.Санкт-Петербург, проспект Большевиков, дом 63, корпус 3, литера З",131915,0
149,"Победы пл., д.3",118110,"город Петергоф, Нижний парк, литера ПЛ",201878,0
148,"Маршала Захарова, д.35",43806,"г.Санкт-Петербург, улица Маршала Захарова, дом 35, корпус 1, литера А",43806,0
147,"Турбинная, д.39",7918,"г.Санкт-Петербург, Турбинная улица, дом 39, литера А",7918,0
146,"7 Советская , д.3",14779,"г.Санкт-Петербург, 2-я Советская улица, дом 7",24144,0
124,"1 Красноармейская, д.22",62443,"г.Санкт-Петербург, 8-я Красноармейская улица, дом 22, литера А",58199,0
122,"Садовая, д.109",78104,"г.Санкт-Петербург, Садовая улица, дом 109, литера А",78104,0
83,"191002, Санкт-Петербург г, Реки Фонтанки наб, д.52",108694,"г.Санкт-Петербург, набережная реки Фонтанки, дом 52, литера В",94612,0
121,"Мечникова, д.3",81162,"г.Санкт-Петербург, проспект Мечникова, дом 5",39014,0
100,"Садовая, д.88",55037,"г.Санкт-Петербург, Садовая улица, дом 88, литера А",55037,0
99,"Дачный, д.32",61237,"г.Санкт-Петербург, Дачный проспект, дом 32, литера А",61237,0
98,"Галерная, д.43",9323,"г.Санкт-Петербург, Галерная улица, дом 43, литера Б",239,0
97,"20 линия, д.15",83775,"г.Санкт-Петербург, 20-я линия В.О., дом 15, литера Т",14294,0
96,"Дачный, д.22/96",50289,"г.Санкт-Петербург, Дачный проспект, дом 22/96, литера А",50289,0
95,"Витебская, д.6-8",86160,"г.Санкт-Петербург, Витебская улица, дом 3, литера А",3123,0
